{
  "schema_version": "1.0.0",
  "generated_at": "2026-09-10T08:58:25Z",
  "source_of_truth": "reconciled",
  "services": [
    {
      "service_id": "ascendant-store",
      "display_name": "Ascendant Store",
      "runtime_kind": "systemd",
      "runtime_location": "foundation-vm",
      "repository_path": null,
      "owner_agent_id": null,
      "owner_role": "Commerce Operations",
      "vertical_id": null,
      "lifecycle_state": "PRODUCTION",
      "truth_state": "VERIFIED",
      "obsidian_home": "08 Verticals/Commerce/Services/Ascendant Store",
      "port": 5090,
      "scheduler": null,
      "dependencies": [],
      "health_signal": "systemd unit ascendant-store.service active/running; TCP 5090 listening (0.0.0.0); / and /health and /success return 200",
      "rollback_reference": null,
      "evidence": [
        {
          "source": "foundation-vm runtime inventory (read-only), workflow run 34448533182, job 102778639794",
          "captured_at": "2026-09-10T07:09:14Z",
          "truth_state": "INFERRED",
          "sha256": null,
          "notes": "Unit ascendant-store.service active/running (VERIFIED). Declared as PORT_MANIFEST[5090]='ascendant-store'. Loopback probe on 5090 returned HTTP 200, so the storefront is already serving. BUT ~/.dominion/ascendant-store/runtime/release is ABSENT and ~/.dominion/ascendant-store/runtime.env is ABSENT, so the running code's deployment source is UNPROVEN and is not the governed release path. A governed deploy to this path would collide with whatever is serving now. Port binding is declared by the repository and the port is listening, but this inventory ran `ss` without -p, so the process-to-port mapping is unproven."
        },
        {
          "source": "foundation-vm listener attribution (read-only), workflow run 34458046789, job 102808985768",
          "captured_at": "2026-09-10T08:58:25Z",
          "truth_state": "VERIFIED",
          "sha256": null,
          "notes": "ATTRIBUTED. pid 3554281, cgroup 0::/system.slice/ascendant-store.service, cmdline '/home/<vm user>/dominion_env/bin/python3 app.py', cwd /home/<vm user>/ascendant_store, bind 0.0.0.0:5090, started 2026-09-04 01:27:03 UTC, up 6 days. FragmentPath /etc/systemd/system/ascendant-store.service, EnvironmentFiles /home/<vm user>/.env.\nSOURCE IS UNGOVERNED: /home/<vm user>/ascendant_store is NOT_A_GIT_CHECKOUT with 4 files, so no deployed SHA exists. ~/.dominion/ascendant-store/runtime/release is ABSENT. The repo tree ~/dominion-ops/ascendant_store is a different tree at stale SHA 0233432.\nCREDENTIALS ARE PRESENT: the process environment carries STRIPE_SECRET_KEY, STRIPE_PUBLISHABLE_KEY, STRIPE_WEBHOOK_SECRET and DB_PASSWORD. Key names only were read.\nROUTES: / 200, /health 200, /success 200, /healthz 404, /products 404, /policies 404.\nNOT PUBLICLY REACHABLE: the Caddyfile carries no route to 5090 at all. store.dominionhealing.org proxies to 127.0.0.1:5080. A 200 on 5090 is not revenue."
        }
      ]
    },
    {
      "service_id": "auric-edge",
      "display_name": "AuricEdge",
      "runtime_kind": "systemd",
      "runtime_location": "foundation-vm",
      "repository_path": null,
      "owner_agent_id": null,
      "owner_role": "Operations",
      "vertical_id": null,
      "lifecycle_state": "PRODUCTION",
      "truth_state": "VERIFIED",
      "obsidian_home": "05 Operations/Services/AuricEdge",
      "port": 9380,
      "scheduler": null,
      "dependencies": [],
      "health_signal": "systemd unit auric_edge.service active/running; TCP 9380 listening (0.0.0.0)",
      "rollback_reference": null,
      "evidence": [
        {
          "source": "foundation-vm runtime inventory (read-only), workflow run 34448533182, job 102778639794",
          "captured_at": "2026-09-10T07:09:14Z",
          "truth_state": "INFERRED",
          "sha256": null,
          "notes": "Unit auric_edge.service active/running (VERIFIED). VERDICT: REAL AND MANAGED. Unit auric_edge.service is active/running. Declared in buddy_core/sentinel.py as PORT_MANIFEST[9380]='auric-edge'. Listening on 0.0.0.0:9380 -- all interfaces, not loopback. /health returned HTTP 404, so no health contract is published. Purpose, source tree and data classification remain undocumented. The all-interface bind is an open security question: host exposure is unrestricted and only the cloud firewall limits reach. Port binding is declared by the repository and the port is listening, but this inventory ran `ss` without -p, so the process-to-port mapping is unproven."
        },
        {
          "source": "foundation-vm listener attribution (read-only), workflow run 34458046789, job 102808985768",
          "captured_at": "2026-09-10T08:58:25Z",
          "truth_state": "VERIFIED",
          "sha256": null,
          "notes": "ATTRIBUTED, binding now proven. pid 2201712, cgroup 0::/system.slice/auric_edge.service, cmdline '/home/<vm user>/dominion_env/bin/python main.py', cwd /home/<vm user>/auric_edge, bind 0.0.0.0:9380, started 2026-08-01, up 40 days. Its environment carries AURIC_API_KEY, DATABASE_URL, DB_HOST, DB_NAME, DB_USER and DB_PASSWORD, so it is a database-backed application with its own credentials. Source tree is outside dominion-ops. /health returns 404: no health contract. The 0.0.0.0 bind remains an open exposure question."
        }
      ]
    },
    {
      "service_id": "baby-api",
      "display_name": "Baby API",
      "runtime_kind": "docker",
      "runtime_location": "foundation-vm",
      "repository_path": null,
      "owner_agent_id": null,
      "owner_role": "Operations",
      "vertical_id": null,
      "lifecycle_state": "PRODUCTION",
      "truth_state": "VERIFIED",
      "obsidian_home": "05 Operations/Services/Baby API",
      "port": 8080,
      "scheduler": null,
      "dependencies": [],
      "health_signal": "Container state and published ports (0.0.0.0:8080->8080/tcp)",
      "rollback_reference": null,
      "evidence": [
        {
          "source": "foundation-vm runtime inventory (read-only), workflow run 34448533182, job 102778639794",
          "captured_at": "2026-09-10T07:09:14Z",
          "truth_state": "VERIFIED",
          "sha256": null,
          "notes": "Container running: image=dominion-ops-baby-api, status=Up 3 days (healthy), ports=0.0.0.0:8080->8080/tcp."
        }
      ]
    },
    {
      "service_id": "baby-logger",
      "display_name": "Baby Logger",
      "runtime_kind": "docker",
      "runtime_location": "foundation-vm",
      "repository_path": null,
      "owner_agent_id": null,
      "owner_role": "Operations",
      "vertical_id": null,
      "lifecycle_state": "PRODUCTION",
      "truth_state": "VERIFIED",
      "obsidian_home": "05 Operations/Services/Baby Logger",
      "port": null,
      "scheduler": null,
      "dependencies": [],
      "health_signal": "Container state and published ports (none published)",
      "rollback_reference": null,
      "evidence": [
        {
          "source": "foundation-vm runtime inventory (read-only), workflow run 34448533182, job 102778639794",
          "captured_at": "2026-09-10T07:09:14Z",
          "truth_state": "VERIFIED",
          "sha256": null,
          "notes": "Container running: image=alpine:latest, status=Up 3 days, ports=none published."
        }
      ]
    },
    {
      "service_id": "browser-agents",
      "display_name": "Browser Agents",
      "runtime_kind": "docker",
      "runtime_location": "foundation-vm",
      "repository_path": null,
      "owner_agent_id": null,
      "owner_role": "Operations",
      "vertical_id": null,
      "lifecycle_state": "PRODUCTION",
      "truth_state": "VERIFIED",
      "obsidian_home": "05 Operations/Services/Browser Agents",
      "port": 8081,
      "scheduler": null,
      "dependencies": [],
      "health_signal": "Container state and published ports (0.0.0.0:8081->8000/tcp)",
      "rollback_reference": null,
      "evidence": [
        {
          "source": "foundation-vm runtime inventory (read-only), workflow run 34448533182, job 102778639794",
          "captured_at": "2026-09-10T07:09:14Z",
          "truth_state": "VERIFIED",
          "sha256": null,
          "notes": "Container running: image=dominion-ops-browser-agents, status=Up 3 days (healthy), ports=0.0.0.0:8081->8000/tcp."
        }
      ]
    },
    {
      "service_id": "buddy-bridge",
      "display_name": "Buddy Bridge",
      "runtime_kind": "systemd",
      "runtime_location": "foundation-vm",
      "repository_path": "buddy_core/buddy_bridge_api.py",
      "owner_agent_id": null,
      "owner_role": "Buddy Operations",
      "vertical_id": null,
      "lifecycle_state": "PRODUCTION",
      "truth_state": "INFERRED",
      "obsidian_home": "05 Operations/Services/Buddy Bridge",
      "port": 5052,
      "scheduler": null,
      "dependencies": [],
      "health_signal": "systemd unit buddy-bridge.service active/running; TCP 5052 listening (0.0.0.0)",
      "rollback_reference": null,
      "evidence": [
        {
          "source": "foundation-vm runtime inventory (read-only), workflow run 34448533182, job 102778639794",
          "captured_at": "2026-09-10T07:09:14Z",
          "truth_state": "INFERRED",
          "sha256": null,
          "notes": "Unit buddy-bridge.service active/running (VERIFIED). Port declared in buddy_core/config/FOUNDER_OPERATING_CONTEXT.md. Loopback probe on 5052 returned HTTP 200. Port binding is declared by the repository and the port is listening, but this inventory ran `ss` without -p, so the process-to-port mapping is unproven."
        }
      ]
    },
    {
      "service_id": "caddy",
      "display_name": "Caddy Reverse Proxy",
      "runtime_kind": "systemd",
      "runtime_location": "foundation-vm",
      "repository_path": null,
      "owner_agent_id": null,
      "owner_role": "Infrastructure Operations",
      "vertical_id": null,
      "lifecycle_state": "PRODUCTION",
      "truth_state": "VERIFIED",